Symbol,Name,Last Sale,Net Change,% Change,Market Cap,Country,IPO Year,Volume,Sector,Industry
PPGHU,Poema Global Holdings Corp. Unit,$10.08,-0.10,-0.982%,0.00,China,2021,200,Finance,Business Services
PPGHW,Poema Global Holdings Corp. Warrant,$0.765,0.005,0.658%,0.00,China,2021,33471,Finance,Business Services
PPIH,Perma-Pipe International Holdings Inc. Common Stock,$6.57,0.0883,1.362%,53643978.00,United States,,14135,,
PPSI,Pioneer Power Solutions Inc. Common Stock,$4.16,0.10,2.463%,36300347.00,United States,,79063,Consumer Durables,Electrical Products
PPTA,Perpetua Resources Corp. Common Shares,$7.45,0.05,0.676%,354044160.00,Canada,,30621,,
PRAA,PRA Group Inc. Common Stock,$37.53,0.39,1.05%,1711124993.00,United States,2002,150380,Technology,Advertising
PRAH,PRA Health Sciences Inc. Common Stock,$166.09,-0.10,-0.06%,10720107645.00,United States,2014,773985,Health Care,Biotechnology: Commercial Physical & Biological Resarch
PRAX,Praxis Precision Medicines Inc. Common Stock,$31.65,1.59,5.289%,1221028990.00,United States,2020,251691,Health Care,Major Pharmaceuticals
PRCH,Porch Group Inc. Common Stock,$13.81,-0.22,-1.568%,1252676251.00,United States,2020,610146,Technology,Computer Software: Prepackaged Software
PRDO,Perdoceo Education Corporation Common Stock,$11.98,0.01,0.084%,843869307.00,United States,,364235,Miscellaneous,Other Consumer Services
PRFT,Perficient Inc. Common Stock,$63.89,-0.14,-0.219%,2115940326.00,United States,1999,189445,Technology,EDP Services
PRFX,PainReform Ltd. Ordinary Shares,$3.37,0.07,2.121%,33910231.00,Israel,2020,299660,Health Care,Major Pharmaceuticals
PRGS,Progress Software Corporation Common Stock (DE),$45.14,-0.09,-0.199%,1986297903.00,United States,1991,422111,Technology,Computer Software: Prepackaged Software
PRIM,Primoris Services Corporation Common Stock,$33.26,-0.05,-0.15%,1786841016.00,United States,,430631,Basic Industries,Water Supply
PRLD,Prelude Therapeutics Incorporated Common Stock,$39.48,3.93,11.055%,1839209753.00,United States,2020,116701,Consumer Durables,Specialty Chemicals
PROF,Profound Medical Corp. Common Stock,$18.84,0.05,0.266%,383336613.00,Canada,,33510,,
PROG,Progenity Inc. Common Stock,$3.02,-0.13,-4.127%,182233489.00,United States,1995,276350,Consumer Durables,Specialty Chemicals
PROV,Provident Financial Holdings Inc. Common Stock,$16.07,0.19,1.196%,119597022.00,United States,,18513,Finance,Savings Institutions
PRPH,ProPhase Labs Inc. Common Stock (DE),$5.47,-0.12,-2.147%,82893764.00,United States,,34483,Health Care,Major Pharmaceuticals
PRPL,Purple Innovation Inc. Common Stock,$35.07,-0.13,-0.369%,2340959183.00,United States,2015,388181,Consumer Durables,Home Furnishings
PRPO,Precipio Inc.  Common Stock,$1.93,-0.01,-0.515%,34994882.00,United States,,159681,Capital Goods,Biotechnology: Laboratory Analytical Instruments
PRQR,ProQR Therapeutics N.V. Ordinary Shares,$6.40,0.05,0.787%,423218477.00,Netherlands,2014,567348,Health Care,Major Pharmaceuticals
PRSR,Prospector Capital Corp. Class A Ordinary Shares,$9.83,0.03,0.306%,399343750.00,United States,2021,11706,Finance,Business Services
PRSRU,Prospector Capital Corp. Unit,$10.07,-0.02,-0.198%,0.00,United States,2021,8728,Finance,Business Services
PRSRW,Prospector Capital Corp. Warrants,$0.875,-0.005,-0.568%,0.00,United States,2021,10242,Finance,Business Services
PRTA,Prothena Corporation plc Ordinary Shares,$26.66,1.52,6.046%,1173365785.00,United States,,223347,Health Care,Major Pharmaceuticals
PRTC,PureTech Health plc American Depositary Shares,$56.80,0.00,0.00%,1623904843.00,United Kingdom,,15,Finance,Investment Managers
PRTG,Portage Biotech Inc. Common Stock,$27.91,0.72,2.648%,337247554.00,Canada,,4108,Health Care,Biotechnology: Biological Products (No Diagnostic Substances)
PRTH,Priority Technology Holdings Inc. Common Stock,$6.63,-0.10,-1.486%,448436678.00,United States,2016,11596,Technology,EDP Services
PRTK,Paratek Pharmaceuticals Inc. Common Stock,$7.90,0.09,1.152%,370638596.00,United States,,222770,Health Care,Major Pharmaceuticals
PRTS,CarParts.com Inc. Common Stock,$17.73,0.07,0.396%,852680894.00,United States,2007,511948,Consumer Services,Other Specialty Stores
PRVB,Provention Bio Inc. Common Stock,$7.72,-0.01,-0.129%,489252977.00,United States,2018,1623530,Health Care,Major Pharmaceuticals
PSAC,Property Solutions Acquisition Corp. Common Stock,$12.05,0.23,1.946%,355673958.00,United States,2020,291153,,
PSACU,Property Solutions Acquisition Corp. Unit,$13.90,0.00,0.00%,0.00,United States,2020,53,,
PSACW,Property Solutions Acquisition Corp. Warrant,$2.18,-0.15,-6.438%,0.00,United States,2020,227085,,
PSAG,Property Solutions Acquisition Corporation II Class A Common Stock,$9.82,0.07,0.718%,0.00,United States,2021,203542,,
PSAGU,Property Solutions Acquisition Corporation II Units,$10.00,0.00,0.00%,0.00,United States,2021,2,,
PSAGW,Property Solutions Acquisition Corporation II Warrant,$0.77,0.02,2.667%,0.00,United States,2021,109273,Finance,Business Services
PSEC,Prospect Capital Corporation Common Stock,$8.17,0.04,0.492%,3161753889.00,United States,2004,2168829,Finance,Finance/Investors Services
PSHG,Performance Shipping Inc. Common Shares,$4.78,0.24,5.286%,24295430.00,Greece,,80884,Transportation,Marine Transportation
PSMT,PriceSmart Inc. Common Stock,$84.41,0.79,0.945%,2595565042.00,United States,,86278,Consumer Services,Department/Specialty Retail Stores
PSNL,Personalis Inc. Common Stock,$25.21,-0.34,-1.331%,1103437566.00,United States,2019,564368,Health Care,Biotechnology: In Vitro & In Vivo Diagnostic Substances
PSTI,Pluristem Therapeutics Inc. Common Stock,$4.52,0.07,1.573%,143465903.00,Israel,,215822,Health Care,Biotechnology: Biological Products (No Diagnostic Substances)
PSTV,PLUS THERAPEUTICS Inc. Common Stock ,$2.37,0.01,0.424%,50021734.00,United States,,279890,Health Care,Medical/Dental Instruments
PSTX,Poseida Therapeutics Inc. Common Stock,$9.65,0.39,4.212%,599343821.00,United States,2020,80414,Consumer Durables,Specialty Chemicals
PT,Pintec Technology Holdings Limited American Depositary Shares,$0.932,-0.008,-0.851%,40204855.00,China,2018,362170,Technology,Computer Software: Programming Data Processing
PTC,PTC Inc. Common Stock,$148.29,0.50,0.338%,17321816885.00,United States,,631628,Technology,Computer Software: Prepackaged Software
PTCT,PTC Therapeutics Inc. Common Stock,$43.35,-2.73,-5.924%,3048472572.00,United States,2013,817397,Health Care,Major Pharmaceuticals
PTE,PolarityTE Inc. Common Stock,$1.03,0.00,0.00%,82728959.00,United States,,737360,Consumer Durables,Specialty Chemicals
PTEN,Patterson-UTI Energy Inc. Common Stock,$6.81,0.44,6.907%,1278849022.00,United States,1993,2214071,Energy,Oil & Gas Production
PTGX,Protagonist Therapeutics Inc. Common Stock,$29.61,0.09,0.305%,1301041074.00,United States,2016,228119,Health Care,Major Pharmaceuticals
PTIC,PropTech Investment Corporation II Class A Common Stock,$9.88,0.03,0.305%,284050000.00,United States,2021,9272,,
PTICU,PropTech Investment Corporation II Unit,$10.19,0.19,1.90%,0.00,United States,2020,21509,,
PTICW,PropTech Investment Corporation II Warrant,$0.77,0.02,2.667%,0.00,United States,2021,3984,Finance,Business Services
PTIX,Protagenic Therapeutics Inc. Common Stock,$2.24,0.00,0.00%,23568173.00,United States,,738841,,
PTIXW,Protagenic Therapeutics Inc. Warrant,$0.3401,0.0101,3.061%,0.00,United States,,153051,,
PTMN,Portman Ridge Finance Corporation Common Stock,$2.33,-0.03,-1.271%,175204679.00,United States,,330989,Finance,Finance/Investors Services
PTNR,Partner Communications Company Ltd. American Depositary Shares,$4.4394,-0.0006,-0.014%,815853070.00,Israel,,1785,Public Utilities,Telecommunications Equipment
PTOCU,Pine Technology Acquisition Corp. Unit,$9.92,-0.08,-0.80%,0.00,United States,2021,36642,,
PTON,Peloton Interactive Inc. Class A Common Stock,$103.22,0.88,0.86%,30398461861.00,United States,2019,6287472,Consumer Services,Other Consumer Services
PTPI,Petros Pharmaceuticals Inc. Common Stock,$3.41,0.04,1.187%,33309770.00,United States,,35966,Health Care,Major Pharmaceuticals
PTRS,Partners Bancorp Common Stock,$7.65,-0.03,-0.391%,135608857.00,United States,,18212,Finance,Major Banks
PTSI,P.A.M. Transportation Services Inc. Common Stock,$57.90,0.40,0.696%,331473968.00,United States,1986,2215,Transportation,Trucking Freight/Courier Services
PTVCA,Protective Insurance Corporation Class A Common Stock,$23.00,-0.095,-0.411%,325591473.00,United States,,58212,Finance,Property-Casualty Insurers
PTVCB,Protective Insurance Corporation Class B Common Stock,$23.00,0.01,0.043%,325591473.00,United States,,15784,Finance,Property-Casualty Insurers
PTVE,Pactiv Evergreen Inc. Common stock,$14.19,-0.01,-0.07%,2513867905.00,United States,2020,104525,Consumer Durables,Containers/Packaging
PUBM,PubMatic Inc. Class A Common Stock,$53.85,1.16,2.202%,2575457240.00,United States,2020,338854,Technology,Computer Software: Prepackaged Software
PUCK,Goal Acquisitions Corp. Common Stock,$9.73,0.01,0.103%,322658963.00,United States,2021,106333,,
PUCKU,Goal Acquisitions Corp. Unit,$10.18,0.00,0.00%,0.00,United States,2021,54444,,
PUCKW,Goal Acquisitions Corp. Warrant,$0.50,-0.01,-1.961%,0.00,United States,2021,148312,Finance,Business Services
PULM,Pulmatrix Inc. Common Stock,$1.03,0.02,1.98%,57936534.00,United States,2014,617599,Health Care,Major Pharmaceuticals
PUYI,Puyi Inc. American Depository Shares,$4.99,0.02,0.402%,300970233.00,China,2019,18776,Finance,Investment Managers
PVAC,Penn Virginia Corporation Common Stock,$13.89,0.80,6.112%,212578297.00,United States,,498189,Energy,Oil & Gas Production
PVBC,Provident Bancorp Inc. (MD) Common Stock,$16.08,0.15,0.942%,298935481.00,United States,2015,40443,Finance,Major Banks
PWFL,PowerFleet Inc. Common Stock,$8.08,-0.07,-0.859%,290692617.00,United States,,34102,Capital Goods,Telecommunications Equipment
PWOD,Penns Woods Bancorp Inc. Common Stock,$23.43,-0.04,-0.17%,165345908.00,United States,,22207,Finance,Major Banks
PXLW,Pixelworks Inc.  Common Stock,$3.11,-0.06,-1.893%,162380629.00,United States,2000,382633,Technology,Semiconductors
PXS,Pyxis Tankers Inc. Common Stock,$0.9128,0.00,0.00%,19679863.00,Greece,,389435,Transportation,Marine Transportation
PXSAP,Pyxis Tankers Inc. 7.75% Series A Cumulative Convertible Preferred Shares,$21.02,0.00,0.00%,0.00,Greece,,3,Transportation,Marine Transportation
PXSAW,Pyxis Tankers Inc. Warrant,$0.3801,-0.0498,-11.584%,0.00,Greece,,4275,Transportation,Marine Transportation
PYPD,PolyPid Ltd. Ordinary Shares,$9.46,0.21,2.27%,177329043.00,Israel,2020,38137,Health Care,Medical/Dental Instruments
PYPL,PayPal Holdings Inc. Common Stock,$271.09,2.27,0.844%,318330498528.00,United States,,5525708,Miscellaneous,Business Services
PYR,PyroGenesis Canada Inc. Common Shares,$4.88,-0.15,-2.982%,802751904.00,Canada,,744127,,
PZZA,Papa John's International Inc. Common Stock,$96.00,0.22,0.23%,3162305088.00,United States,1993,363601,Consumer Services,Restaurants
QADA,QAD Inc. Class A Common Stock,$73.50,0.53,0.726%,1522204478.00,United States,,23209,Technology,Computer Software: Prepackaged Software
QADB,QAD Inc. Class B Common Stock,$51.00,0.75,1.493%,1056223515.00,United States,,1017,Technology,Computer Software: Prepackaged Software
QCOM,QUALCOMM Incorporated Common Stock,$136.57,-1.44,-1.043%,155143520000.00,United States,1991,13048120,Technology,Computer peripheral equipment
QCRH,QCR Holdings Inc. Common Stock,$47.60,-0.50,-1.04%,754112520.00,United States,,30232,Finance,Major Banks
QDEL,Quidel Corporation Common Stock,$111.00,-4.02,-3.495%,4722247248.00,United States,,692251,Health Care,Biotechnology: In Vitro & In Vivo Diagnostic Substances
QELL,Qell Acquisition Corp. Class A Ordinary Shares,$9.91,-0.01,-0.101%,419974661.00,United States,2020,195828,Finance,Business Services
QELLU,Qell Acquisition Corp. Unit,$10.35,-0.02,-0.193%,0.00,United States,2020,13639,Finance,Business Services
QELLW,Qell Acquisition Corp. Warrant,$1.41,0.03,2.174%,0.00,United States,2020,32179,Finance,Business Services
QFIN,360 DigiTech Inc. American Depositary Shares,$28.08,1.01,3.731%,4279279708.00,China,2018,1600670,Finance,Finance: Consumer Services
QH,Quhuo Limited American Depository Shares,$5.15,-0.04,-0.771%,267318012.00,China,2020,75305,Miscellaneous,Business Services
QIWI,QIWI plc American Depositary Shares,$10.78,0.10,0.936%,676045871.00,Cyprus,2013,157488,Miscellaneous,Business Services
QK,Q&K International Group Limited American Depositary Shares,$2.03,-0.02,-0.976%,110049002.00,China,2019,22763,Finance,Real Estate
QLGN,Qualigen Therapeutics Inc. Common Stock,$2.23,0.12,5.687%,64180992.00,United States,2015,446537,Health Care,Biotechnology: Commercial Physical & Biological Resarch
QLI,Qilian International Holding Group Ltd. Ordinary Shares,$4.59,0.06,1.325%,164092500.00,China,2021,26755,Health Care,Major Pharmaceuticals
QLYS,Qualys Inc. Common Stock,$104.85,-2.45,-2.283%,4109266416.00,United States,2012,297493,Technology,EDP Services
QMCO,Quantum Corporation Common Stock,$8.71,-0.12,-1.359%,493536533.00,United States,,112661,Technology,Electronic Components
QNST,QuinStreet Inc. Common Stock,$20.73,0.18,0.876%,1104836466.00,United States,2010,281990,Technology,Advertising
QQQX,Nuveen NASDAQ 100 Dynamic Overwrite Fund Shares of Beneficial Interest,$28.32,0.02,0.071%,1175503785.00,United States,,56514,Finance,Finance Companies
QRHC,Quest Resource Holding Corporation Common Stock,$3.86,0.02,0.521%,71075797.00,United States,,16912,Capital Goods,Building Products
QRTEA,Qurate Retail Inc. Series A Common Stock ,$12.49,-0.07,-0.557%,5140742114.00,United States,,2239931,Consumer Services,Catalog/Specialty Distribution
QRTEB,Qurate Retail Inc. Series B Common Stock ,$12.57,-0.04,-0.317%,5173669205.00,United States,,1442,Consumer Services,Catalog/Specialty Distribution
QRTEP,Qurate Retail Inc. 8.0% Fixed Rate Cumulative Redeemable Preferred Stock,$104.90,0.8436,0.811%,0.00,United States,,26813,Consumer Services,Catalog/Specialty Distribution
QRVO,Qorvo Inc. Common Stock,$197.05,-1.33,-0.67%,22318416414.00,United States,,696273,Capital Goods,Industrial Machinery/Components
QTNT,Quotient Limited Ordinary Shares,$3.89,0.05,1.302%,393408354.00,Switzerland,2014,205737,Health Care,Biotechnology: In Vitro & In Vivo Diagnostic Substances
QTRX,Quanterix Corporation Common Stock,$67.00,0.85,1.285%,2429929803.00,United States,2017,221095,Health Care,Industrial Specialties
QTT,Qutoutiao Inc. American Depositary Shares,$2.45,0.03,1.24%,704354792.00,China,2018,2006523,Technology,Computer Software: Prepackaged Software
QUIK,QuickLogic Corporation Common Stock,$6.64,-0.22,-3.207%,74834726.00,United States,1999,29986,Technology,Semiconductors
QUMU,Qumu Corporation Common Stock,$6.00,0.25,4.348%,105541464.00,United States,,15867,Technology,Retail: Computer Software & Peripheral Equipment
QURE,uniQure N.V. Ordinary Shares,$33.15,-1.08,-3.155%,1491550669.00,Netherlands,2014,889455,Health Care,Major Pharmaceuticals
RAAC,Revolution Acceleration Acquisition Corp Class A Common Stock,$9.95,-0.09,-0.896%,381416663.00,United States,2021,184423,,
RAACU,Revolution Acceleration Acquisition Corp Unit,$10.51,-0.075,-0.709%,0.00,United States,2020,8703,,
RAACW,Revolution Acceleration Acquisition Corp Warrant,$1.85,0.115,6.628%,0.00,United States,2021,31185,Finance,Business Services
RACA,Therapeutics Acquisition Corp. Class A Common Stock,$10.15,0.04,0.396%,181375425.00,United States,2020,276123,,
RACB,Research Alliance Corp. II Class A Common Stock,$10.73,0.00,0.00%,205871145.00,United States,2021,27,,
RADA,RADA Electronic Industries Ltd. Ordinary Shares,$12.34,-0.05,-0.404%,536605702.00,Israel,,203571,,
RADI,Radius Global Infrastructure Inc. Class A Common Stock,$14.93,0.05,0.336%,913856969.00,United States,,234764,Consumer Services,Telecommunications Equipment
RAIL,FreightCar America Inc. Common Stock,$7.34,0.09,1.241%,114417916.00,United States,2005,1106096,Capital Goods,Railroads
RAIN,Rain Therapeutics Inc. Common Stock,$16.20,0.86,5.606%,420700392.00,United States,2021,374299,Health Care,Major Pharmaceuticals
RAND,Rand Capital Corporation Common Stock,$18.65,0.6029,3.341%,48157452.00,United States,,437,Finance,Finance/Investors Services
RAPT,RAPT Therapeutics Inc. Common Stock,$21.93,0.03,0.137%,545352082.00,United States,2019,101105,Health Care,Major Pharmaceuticals
RARE,Ultragenyx Pharmaceutical Inc. Common Stock,$114.85,1.49,1.314%,7689120673.00,United States,2014,247710,Health Care,Major Pharmaceuticals
RAVE,Rave Restaurant Group Inc. Common Stock,$1.36,-0.03,-2.158%,24486669.00,United States,,435370,Consumer Services,Restaurants
RAVN,Raven Industries Inc. Common Stock,$40.78,0.26,0.642%,1462758169.00,United States,,104269,Capital Goods,Office Equipment/Supplies/Services
RBB,RBB Bancorp Common Stock,$20.05,0.21,1.058%,391541372.00,United States,2017,29624,Finance,Commercial Banks
RBBN,Ribbon Communications Inc. Common Stock,$8.14,-0.005,-0.061%,1199498923.00,United States,,477334,Technology,EDP Services
RBCAA,Republic Bancorp Inc. Class A Common Stock,$44.44,0.03,0.068%,925507440.00,United States,1998,33763,Finance,Major Banks
RBCN,Rubicon Technology Inc. Common Stock,$10.59,0.105,1.001%,25651680.00,United States,2007,1323,Technology,Semiconductors
RBKB,Rhinebeck Bancorp Inc. Common Stock,$10.71,0.00,0.00%,119237536.00,United States,2019,168,Finance,Major Banks
RBNC,Reliant Bancorp Inc. Common Stock,$27.81,0.25,0.907%,455673024.00,United States,,31893,Finance,Major Banks
RCAT,Red Cat Holdings Inc.,$4.30,0.28,6.965%,,United States,,121039,,
RCEL,Avita Therapeutics Inc. Common Stock,$20.67,0.62,3.092%,513502392.00,Australia,,110826,Health Care,Medical Specialities
RCHG,Recharge Acquisition Corp. Class A Common Stock,$9.8408,-0.0492,-0.497%,246512040.00,United States,2020,496,,
RCHGU,Recharge Acquisition Corp. Unit,$10.16,0.06,0.594%,0.00,United States,2020,400,,
RCHGW,Recharge Acquisition Corp. Warrant,$0.725,-0.0294,-3.897%,0.00,United States,2020,7945,Finance,Business Services
RCII,Rent-A-Center Inc. Common Stock,$59.00,-1.00,-1.667%,3912188933.00,United States,1995,561740,Technology,Diversified Commercial Services
RCKT,Rocket Pharmaceuticals Inc. Common Stock,$46.16,-0.51,-1.093%,2851685359.00,United States,2015,305953,Health Care,Major Pharmaceuticals
RCKY,Rocky Brands Inc. Common Stock,$53.36,-4.34,-7.522%,388498739.00,United States,1993,95481,Consumer Non-Durables,Shoe Manufacturing
RCLF,Rosecliff Acquisition Corp I Class A Common Stock,$9.75,0.06,0.619%,308343750.00,United States,2021,2565,,
RCLFU,Rosecliff Acquisition Corp I Unit,$9.98,0.01,0.10%,0.00,United States,2021,30647,,
RCLFW,Rosecliff Acquisition Corp I Warrants,$0.66,0.0566,9.38%,0.00,United States,2021,833,Finance,Business Services
RCM,R1 RCM Inc. Common Stock,$27.29,0.42,1.563%,7130678711.00,United States,,444563,Consumer Services,Other Consumer Services
RCMT,RCM Technologies Inc. Common Stock,$3.66,0.09,2.521%,42036235.00,United States,,35629,Consumer Services,Military/Government/Technical
RCON,Recon Technology Ltd. Class A Ordinary Shares,$8.91,0.24,2.768%,64177233.00,China,2009,148183,Energy,Oilfield Services/Equipment
RDCM,Radcom Ltd. Ordinary Shares,$9.49,0.065,0.69%,132325295.00,Israel,1997,1017,Technology,Computer peripheral equipment
RDFN,Redfin Corporation Common Stock,$70.04,-0.71,-1.004%,7228578637.00,United States,2017,1887104,Finance,Real Estate
RDHL,Redhill Biopharma Ltd. American Depositary Shares,$7.08,0.05,0.711%,3284759274.00,Israel,,118009,Health Care,Major Pharmaceuticals
RDI,Reading International Inc Class A Common Stock,$6.02,-0.03,-0.496%,131243314.00,United States,,21692,Consumer Services,Movies/Entertainment
RDIB,Reading International Inc Class B Common Stock,$20.50,0.00,0.00%,446924908.00,United States,,26,Consumer Services,Movies/Entertainment
RDNT,RadNet Inc. Common Stock,$22.44,0.42,1.907%,1172985744.00,United States,,140697,Health Care,Medical Specialities
RDUS,Radius Health Inc. Common Stock,$22.16,-0.04,-0.18%,1046828184.00,United States,2014,262378,Health Care,Major Pharmaceuticals
RDVT,Red Violet Inc. Common Stock ,$21.10,-0.48,-2.224%,257590425.00,United States,,38024,Technology,Computer Software: Prepackaged Software
RDWR,Radware Ltd. Ordinary Shares,$28.44,-0.87,-2.968%,1295013694.00,Israel,1999,686129,Technology,EDP Services
REAL,The RealReal Inc. Common Stock,$25.60,2.08,8.844%,2299781632.00,United States,2019,3415624,Consumer Services,Catalog/Specialty Distribution
REDU,RISE Education Cayman Ltd American Depositary Shares,$3.45,-0.17,-4.696%,194866026.00,China,2017,38269,Miscellaneous,Service to the Health Industry
REED,Reeds Inc. Common Stock,$1.04,-0.03,-2.804%,89859454.00,United States,,574886,Consumer Non-Durables,Beverages (Production/Distribution)
REFR,Research Frontiers Incorporated Common Stock,$2.73,-0.12,-4.211%,86405581.00,United States,,231432,Capital Goods,Industrial Machinery/Components
REG,Regency Centers Corporation Common Stock,$62.67,-0.30,-0.476%,10643180610.00,United States,1993,704589,Consumer Services,Real Estate Investment Trusts
REGI,Renewable Energy Group Inc. Common Stock,$58.07,-1.00,-1.693%,2630034665.00,United States,2012,906107,Basic Industries,Major Chemicals
REGN,Regeneron Pharmaceuticals Inc. Common Stock,$487.77,-4.04,-0.821%,51958826142.00,United States,1991,653987,Health Care,Major Pharmaceuticals
REKR,Rekor Systems Inc. Common Stock,$23.81,-1.42,-5.628%,971548454.00,United States,,606462,Technology,EDP Services
RELI,Reliance Global Group Inc. Common Stock,$3.60,-0.02,-0.552%,14983614.00,United States,,25903,Finance,Specialty Insurers
RELIW,Reliance Global Group Inc. Series A Warrants,$0.80,0.00,0.00%,0.00,United States,,2302,Consumer Services,Broadcasting
RELL,Richardson Electronics Ltd. Common Stock,$7.99,-0.51,-6.00%,105529155.00,United States,1983,105951,Technology,Electronic Components
REPH,Recro Pharma Inc. Common Stock,$2.85,0.02,0.707%,88387959.00,United States,2014,122504,Health Care,Major Pharmaceuticals
REPL,Replimune Group Inc. Common Stock,$34.99,1.98,5.998%,1626806410.00,United States,2018,465430,Health Care,Major Pharmaceuticals
RESN,Resonant Inc. Common Stock,$3.63,0.04,1.114%,218744246.00,United States,2014,863122,Technology,Semiconductors
RETA,Reata Pharmaceuticals Inc. Class A Common Stock,$103.79,0.70,0.679%,3757294006.00,United States,2016,353272,Health Care,Major Pharmaceuticals
RETO,ReTo Eco-Solutions Inc. Common Shares,$1.14,0.01,0.885%,27513900.00,China,2017,211774,Capital Goods,Multi-Sector Companies
REVHU,Revolution Healthcare Acquisition Corp. SAIL Units,$10.19,-0.16,-1.546%,0.00,United States,2021,1940437,,
REYN,Reynolds Consumer Products Inc. Common Stock,$29.49,-0.19,-0.64%,6185762948.00,United States,2020,518049,Capital Goods,Office Equipment/Supplies/Services
RFIL,RF Industries Ltd. Common Stock,$6.48,0.00,0.00%,64621515.00,United States,,37123,Capital Goods,Electrical Products
RGCO,RGC Resources Inc. Common Stock,$21.69,-0.17,-0.778%,178192872.00,United States,,36222,Public Utilities,Oil & Gas Production
RGEN,Repligen Corporation Common Stock,$219.74,-1.21,-0.548%,12063559437.00,United States,1986,257500,Health Care,Medical/Dental Instruments
RGLD,Royal Gold Inc. Common Stock,$115.84,1.01,0.88%,7599856497.00,United States,,251437,,
RGLS,Regulus Therapeutics Inc. Common Stock,$1.53,0.06,4.082%,110932301.00,United States,2012,592734,Health Care,Major Pharmaceuticals
RGNX,REGENXBIO Inc. Common Stock,$35.80,0.89,2.549%,1521683153.00,United States,2015,185293,Health Care,Biotechnology: Biological Products (No Diagnostic Substances)
RGP,Resources Connection Inc. Common Stock,$13.96,0.06,0.432%,458209387.00,United States,,127194,Miscellaneous,Business Services
RIBT,RiceBran Technologies Common Stock,$1.27,0.09,7.627%,57498018.00,United States,,61697259,Consumer Non-Durables,Specialty Foods
RICK,RCI Hospitality Holdings Inc. Common Stock,$69.40,1.00,1.462%,624593754.00,United States,1995,54605,Consumer Services,Restaurants
RIDE,Lordstown Motors Corp. Class A Common Stock,$10.27,-0.22,-2.097%,1694025439.00,United States,2019,2568523,Capital Goods,Construction/Ag Equipment/Trucks
RIGL,Rigel Pharmaceuticals Inc. Common Stock,$3.78,-0.05,-1.305%,643056004.00,United States,2000,1976503,Health Care,Major Pharmaceuticals
RILY,B. Riley Financial Inc. Common Stock,$71.44,-0.90,-1.244%,1942804299.00,United States,,162258,Finance,Investment Managers
RILYG,B. Riley Financial Inc. 7.25% Senior Notes due 2027,$25.28,0.0025,0.01%,0.00,United States,,3958,Miscellaneous,Business Services
RILYH,B. Riley Financial Inc. 7.375% Senior Notes due 2023,$25.70,0.00,0.00%,0.00,United States,,5595,Miscellaneous,Business Services
RILYI,B. Riley Financial Inc. 6.875% Senior Notes due 2023,$25.62,-0.0415,-0.162%,0.00,United States,,898,Miscellaneous,Business Services
RILYK,B. Riley Financial Inc. 5.50% Senior Notes Due 2026,$25.15,0.06,0.239%,0.00,United States,,84373,Miscellaneous,Business Services
RILYL,B. Riley Financial Inc. Depositary Shares each representing 1/1000th in a share of 7.375% Series B Cumulative Perpetual Preferred Stock par value $0.0001,$27.48,0.35,1.29%,0.00,United States,,9797,Finance,Investment Managers
RILYM,B. Riley Financial Inc. 6.375% Senior Notes due 2025,$25.69,0.11,0.43%,0.00,United States,,6313,Miscellaneous,Business Services
RILYN,B. Riley Financial Inc. 6.50% Senior Notes Due 2026,$25.89,0.09,0.349%,0.00,United States,,35309,Miscellaneous,Business Services
RILYO,B. Riley Financial Inc. 6.75% Senior Notes due 2024,$25.72,-0.03,-0.117%,0.00,United States,,679,Miscellaneous,Business Services
RILYP,B. Riley Financial Inc. Depositary Shares each representing a 1/1000th fractional interest in a share of Series A Cumulative Perpetual Preferred Stock,$27.20,0.20,0.741%,0.00,United States,,3797,Finance,Investment Managers
