Symbol,Name,Last Sale,Net Change,% Change,Market Cap,Country,IPO Year,Volume,Sector,Industry
ITACW,Industrial Tech Acquisitions Inc. Warrant,$1.16,-0.01,-0.855%,0.00,United States,2020,35419,,
ITCI,Intra-Cellular Therapies Inc. Common Stock,$34.23,0.65,1.936%,2769789355.00,United States,,268124,Health Care,Major Pharmaceuticals
ITHX,ITHAX Acquisition Corp. Class A Ordinary Shares,$9.69,0.00,0.00%,0.00,United States,2021,2,Finance,Business Services
ITHXU,ITHAX Acquisition Corp. Unit,$9.925,-0.065,-0.651%,0.00,United States,2021,100,Finance,Business Services
ITHXW,ITHAX Acquisition Corp. Warrant,$0.5501,0.0289,5.545%,0.00,United States,2021,7112,Finance,Business Services
ITI,Iteris Inc. Common Stock,$7.30,-0.16,-2.145%,303976322.00,United States,,257219,Capital Goods,Telecommunications Equipment
ITIC,Investors Title Company Common Stock,$173.13,1.93,1.127%,327929342.00,United States,,4638,Finance,Specialty Insurers
ITMR,Itamar Medical Ltd. American Depository Shares,$24.04,0.20,0.839%,393946293.00,Israel,,6535,Health Care,Medical/Dental Instruments
ITOS,iTeos Therapeutics Inc. Common Stock,$24.11,0.65,2.771%,846236866.00,United States,2020,188379,Consumer Durables,Specialty Chemicals
ITQ,Itiquira Acquisition Corp. Class A Ordinary Shares,$9.74,-0.01,-0.103%,0.00,United States,2021,51293,Finance,Business Services
ITQRU,Itiquira Acquisition Corp. Unit,$9.99,0.0053,0.053%,0.00,United States,2021,61124,Finance,Business Services
ITQRW,Itiquira Acquisition Corp. Warrant,$0.50,0.00,0.00%,0.00,United States,2021,38881,Finance,Business Services
ITRI,Itron Inc. Common Stock,$93.21,-0.19,-0.203%,4205792166.00,United States,1993,188656,Capital Goods,Electrical Products
ITRM,Iterum Therapeutics plc Ordinary Share,$1.24,0.04,3.333%,218832674.00,Ireland,2018,6019287,Health Care,Major Pharmaceuticals
ITRN,Ituran Location and Control Ltd. Ordinary Shares,$22.51,0.04,0.178%,528431952.00,Israel,2005,61782,Technology,Electronic Components
IVA,Inventiva S.A. American Depository Shares,$13.22,0.06,0.456%,510692050.00,France,2020,4547,Consumer Services,Other Consumer Services
IVAC,Intevac Inc. Common Stock,$6.77,-0.16,-2.309%,163199495.00,United States,1995,116749,,
IZEA,IZEA Worldwide Inc. Common Stock,$3.97,0.11,2.85%,234743678.00,United States,,2840500,Technology,Advertising
JACK,Jack In The Box Inc. Common Stock,$118.40,-0.53,-0.446%,2702819808.00,United States,,185779,Consumer Services,Restaurants
JAGX,Jaguar Health Inc. Common Stock,$1.66,0.02,1.22%,212328238.00,United States,2015,4201669,Health Care,Major Pharmaceuticals
JAKK,JAKKS Pacific Inc. Common Stock,$7.335,-0.025,-0.34%,44578815.00,United States,1996,156230,Consumer Non-Durables,Recreational Products/Toys
JAMF,Jamf Holding Corp. Common Stock,$37.10,-0.31,-0.829%,4366315139.00,United States,2020,127610,Technology,Computer Software: Prepackaged Software
JAN,JanOne Inc. Common Stock (NV),$7.22,0.05,0.697%,17352620.00,United States,,58090,Public Utilities,Environmental Services
JAZZ,Jazz Pharmaceuticals plc Common Stock (Ireland),$165.15,1.93,1.182%,9395668879.00,Ireland,2007,719663,Health Care,Major Pharmaceuticals
JBHT,J.B. Hunt Transport Services Inc. Common Stock,$168.92,-0.72,-0.424%,17849945320.00,United States,,368606,Transportation,Trucking Freight/Courier Services
JBLU,JetBlue Airways Corporation Common Stock,$20.02,-0.10,-0.497%,6339070458.00,United States,2002,6539354,Transportation,Air Freight/Delivery Services
JBSS,John B. Sanfilippo & Son Inc. Common Stock,$88.17,-0.72,-0.81%,1010958366.00,United States,1991,48691,Consumer Non-Durables,Specialty Foods
JCIC,Jack Creek Investment Corp. Class A Ordinary Shares,$9.725,0.02,0.206%,419390625.00,United States,2021,63141,Finance,Business Services
JCICU,Jack Creek Investment Corp. Units,$10.03,0.015,0.15%,0.00,United States,2021,110262,Finance,Business Services
JCICW,Jack Creek Investment Corp. Warrants,$0.6575,0.0074,1.138%,0.00,United States,2021,64480,Finance,Business Services
JCOM,j2 Global Inc. Common Stock,$122.00,-0.28,-0.229%,5508234242.00,United States,1999,298069,Technology,Telecommunications Equipment
JCS,Communications Systems Inc. Common Stock,$5.88,-0.19,-3.13%,54846135.00,United States,,12566,Public Utilities,Telecommunications Equipment
JCTCF,Jewett-Cameron Trading Company Common Shares,$9.90,-0.1824,-1.809%,34542694.00,United States,,216,,
JD,JD.com Inc. American Depositary Shares,$79.06,0.60,0.765%,123253374577.00,China,2014,7030389,Miscellaneous,Business Services
JFIN,Jiayin Group Inc. American Depositary Shares,$6.85,-0.65,-8.667%,370071250.00,China,2019,698192,Finance,Finance: Consumer Services
JFU,9F Inc. American Depositary Shares,$1.53,-0.04,-2.548%,298642230.00,China,2019,516882,Finance,Finance: Consumer Services
JG,Aurora Mobile Limited American Depositary Shares,$4.21,0.69,19.602%,496415313.00,China,2018,11857540,Technology,EDP Services
JJSF,J & J Snack Foods Corp. Common Stock,$160.41,-1.86,-1.146%,3044523571.00,United States,1986,705883,Consumer Non-Durables,Specialty Foods
JKHY,Jack Henry & Associates Inc. Common Stock,$163.57,0.06,0.037%,12443958890.00,United States,1985,334963,Technology,Retail: Computer Software & Peripheral Equipment
JMPNL,JMP Group LLC 7.25% Senior Notes due 2027,$25.87,0.00,0.00%,0.00,United States,,80,,
JMPNZ,JMP Group LLC 6.875% Senior Notes due 2029,$25.09,-0.21,-0.83%,0.00,United States,,13689,Finance,Investment Bankers/Brokers/Service
JNCE,Jounce Therapeutics Inc. Common Stock,$9.62,-0.41,-4.088%,492001057.00,United States,2017,180538,Health Care,Major Pharmaceuticals
JOAN,JOANN Inc. Common Stock,$13.53,0.13,0.97%,548225777.00,United States,2021,195065,Consumer Non-Durables,Department/Specialty Retail Stores
JOBS,51job Inc. American Depositary Shares,$62.31,-0.39,-0.622%,4201746118.00,China,2004,150199,Technology,Diversified Commercial Services
JOFF,JOFF Fintech Acquisition Corp. Class A Common Stock,$9.76,0.03,0.308%,0.00,United States,2021,267807,,
JOFFU,JOFF Fintech Acquisition Corp. Unit,$10.00,0.00,0.00%,0.00,United States,2021,563467,,
JOFFW,JOFF Fintech Acquisition Corp. Warrant,$0.8201,-0.0299,-3.518%,0.00,United States,2021,29657,Finance,Business Services
JOUT,Johnson Outdoors Inc. Class A Common Stock,$145.28,-1.60,-1.089%,1469096348.00,United States,,18145,Consumer Non-Durables,Recreational Products/Toys
JRJC,China Finance Online Co. Limited American Depositary Shares,$10.55,-0.26,-2.405%,25762678.00,China,2004,10954,Finance,Investment Bankers/Brokers/Service
JRSH,Jerash Holdings (US) Inc. Common Stock,$6.78,0.08,1.194%,76783500.00,United States,2018,6712,Basic Industries,Industrial Specialties
JRVR,James River Group Holdings Ltd. Common Shares,$46.68,-0.09,-0.192%,1436134007.00,Bermuda,2014,144361,Finance,Property-Casualty Insurers
JSM,Navient Corporation 6% Senior Notes due December 15 2043,$24.35,-0.04,-0.164%,0.00,United States,,59043,Finance,Finance: Consumer Services
JUPW,Jupiter Wellness Inc. Common Stock,$4.76,0.06,1.277%,53598495.00,United States,2020,263077,Health Care,Major Pharmaceuticals
JUPWW,Jupiter Wellness Inc. Warrant,$2.04,-0.0486,-2.327%,0.00,United States,2020,518,Health Care,Major Pharmaceuticals
JVA,Coffee Holding Co. Inc. Common Stock,$4.77,-0.06,-1.242%,27230017.00,United States,2005,22644,Consumer Non-Durables,Specialty Foods
JWEL,Jowell Global Ltd. Ordinary Shares,$7.79,0.00,0.00%,193688309.00,China,2021,29974,Consumer Services,Other Consumer Services
JYAC,Jiya Acquisition Corp. Class A Common Stock,$10.04,0.04,0.40%,135008794.00,United States,2020,14445,,
JYNT,The Joint Corp. Common Stock,$57.73,1.43,2.54%,823084667.00,United States,2014,150155,,
KAII,Kismet Acquisition Two Corp. Class A Ordinary Shares,$9.68,-0.05,-0.514%,283140000.00,United States,2021,1465,Finance,Business Services
KAIIU,Kismet Acquisition Two Corp. Unit,$9.95,0.00,0.00%,0.00,United States,2021,151,Finance,Business Services
KAIIW,Kismet Acquisition Two Corp. Warrant,$0.5701,-0.0279,-4.666%,0.00,United States,2021,46849,Finance,Business Services
KAIR,Kairos Acquisition Corp. Class A Ordinary Shares,$9.77,-0.03,-0.306%,269652000.00,United States,2021,8254,Finance,Business Services
KAIRU,Kairos Acquisition Corp. Unit,$10.06,0.01,0.10%,0.00,United States,2021,22127,Finance,Business Services
KAIRW,Kairos Acquisition Corp. Warrant,$0.6801,-0.06,-8.107%,0.00,United States,2021,8855,Finance,Business Services
KALA,Kala Pharmaceuticals Inc. Common Stock,$8.00,-0.15,-1.84%,448478920.00,United States,2017,1017260,Health Care,Major Pharmaceuticals
KALU,Kaiser Aluminum Corporation Common Stock,$124.24,4.49,3.749%,1964503877.00,United States,,134083,Basic Industries,Aluminum
KALV,KalVista Pharmaceuticals Inc. Common Stock,$25.65,0.59,2.354%,623505099.00,United Kingdom,2015,397808,Health Care,Major Pharmaceuticals
KARO,Karooooo Ltd. Ordinary Shares,$41.17,2.19,5.618%,1274257034.00,Singapore,2021,61187,Technology,Computer Software: Prepackaged Software
KBAL,Kimball International Inc. Class B Common Stock,$14.08,-0.03,-0.213%,519297321.00,United States,,71371,Consumer Durables,Industrial Specialties
KBNT,Kubient Inc. Common Stock,$6.70,0.19,2.919%,92952517.00,United States,2020,132753,Technology,EDP Services
KBNTW,Kubient Inc. Warrant,$2.25,-0.19,-7.787%,0.00,United States,2020,12104,Technology,EDP Services
KBSF,KBS Fashion Group Limited Common Stock,$2.86,-0.01,-0.348%,7411115.00,China,2013,290244,Consumer Non-Durables,Apparel
KC,Kingsoft Cloud Holdings Limited American Depositary Shares,$48.41,0.03,0.062%,10811128734.00,China,2020,721998,Technology,Computer Software: Prepackaged Software
KCAPL,KCAP Financial Inc. 6.125% Notes due 2022,$25.61,0.05,0.196%,0.00,United States,,310,,
KDMN,Kadmon Holdings Inc. Common Stock,$4.16,0.20,5.051%,714758491.00,United States,,1721750,Health Care,Major Pharmaceuticals
KDNY,Chinook Therapeutics Inc. Common Stock,$15.98,0.61,3.969%,677191363.00,United States,2015,540615,Health Care,Major Pharmaceuticals
KDP,Keurig Dr Pepper Inc. Common Stock,$35.21,-0.30,-0.845%,49549880647.00,United States,,4007610,Consumer Non-Durables,Beverages (Production/Distribution)
KE,Kimball Electronics Inc. Common Stock,$22.19,-0.12,-0.538%,553797184.00,United States,,73207,Capital Goods,Industrial Machinery/Components
KELYA,Kelly Services Inc. Class A Common Stock,$24.64,0.14,0.571%,968046489.00,United States,,107263,Technology,Diversified Commercial Services
KELYB,Kelly Services Inc. Class B Common Stock,$25.3974,-0.3226,-1.254%,997802918.00,United States,,3279,Technology,Diversified Commercial Services
KEQU,Kewaunee Scientific Corporation Common Stock,$12.06,0.00,0.00%,33319332.00,United States,,1,Capital Goods,Medical Specialities
KERN,Akerna Corp. Common Stock,$4.50,0.15,3.448%,63264182.00,United States,2018,7404244,Health Care,Managed Health Care
KERNW,Akerna Corp Warrant,$1.06,0.1101,11.591%,0.00,United States,2018,56554,,
KFFB,Kentucky First Federal Bancorp Common Stock,$7.10,-0.02,-0.281%,58409677.00,United States,,2540,Finance,Savings Institutions
KFRC,Kforce Inc. Common Stock,$56.20,0.34,0.609%,1241291030.00,United States,1995,107537,Technology,Diversified Commercial Services
KHC,The Kraft Heinz Company Common Stock,$40.12,0.02,0.05%,49071432576.00,United States,,7402518,Consumer Non-Durables,Farming/Seeds/Milling
KIDS,OrthoPediatrics Corp. Common Stock,$56.40,0.88,1.585%,1108790837.00,United States,2017,95229,Health Care,Medical/Dental Instruments
KIII,Kismet Acquisition Three Corp. Class A Ordinary Shares,$9.7209,-0.0091,-0.094%,354205294.00,United States,2021,10336,Finance,Business Services
KIIIU,Kismet Acquisition Three Corp. Unit,$9.97,0.00,0.00%,0.00,United States,2021,640,Finance,Business Services
KIIIW,Kismet Acquisition Three Corp. Warrant,$0.65,0.00,0.00%,0.00,United States,2021,187303,Finance,Business Services
KIN,Kindred Biosciences Inc. Common Stock,$4.84,0.17,3.64%,200614215.00,United States,2013,320606,Health Care,Major Pharmaceuticals
KINS,Kingstone Companies Inc. Common Stock,$8.55,-0.05,-0.581%,91497030.00,United States,,13286,Finance,Specialty Insurers
KINZ,KINS Technology Group Inc. Class A Common Stock,$9.93,0.00,0.00%,342585000.00,United States,2021,55,,
KINZU,KINS Technology Group Inc. Unit,$10.22,0.00,0.00%,0.00,United States,2020,119,,
KINZW,KINS Technology Group Inc. Warrant,$0.788,0.028,3.684%,0.00,United States,2021,10889,Finance,Business Services
KIRK,Kirkland's Inc. COMMONSTOCK,$31.06,1.30,4.368%,444010682.00,United States,2002,307356,Miscellaneous,Diversified Commercial Services
KLAC,KLA Corporation Common Stock,$324.84,-5.65,-1.71%,50049609631.00,United States,1980,982286,Capital Goods,Electronic Components
KLAQ,KL Acquisition Corp Class A Common Stock,$9.77,0.02,0.205%,351109375.00,United States,2021,1985,,
KLAQU,KL Acquisition Corp Unit,$9.98,0.00,0.00%,0.00,United States,2021,1450,,
KLAQW,KL Acquisition Corp Warrant,$0.85,0.00,0.00%,0.00,United States,2021,5806,Finance,Business Services
KLDO,Kaleido Biosciences Inc. Common Stock,$7.96,0.31,4.052%,338035656.00,United States,2019,151763,Health Care,Biotechnology: Biological Products (No Diagnostic Substances)
KLIC,Kulicke and Soffa Industries Inc. Common Stock,$57.89,-0.38,-0.652%,3593636777.00,Singapore,,715356,Technology,Semiconductors
KLXE,KLX Energy Services Holdings Inc. Common Stock,$8.52,0.07,0.828%,70716000.00,United States,,212454,Energy,Oilfield Services/Equipment
KMDA,Kamada Ltd. Ordinary Shares,$6.12,0.01,0.164%,273841628.00,Israel,2013,75594,Health Care,Major Pharmaceuticals
KMPH,KemPharm Inc. Common Stock,$9.62,0.16,1.691%,272980208.00,United States,,467521,Health Care,Major Pharmaceuticals
KNBE,KnowBe4 Inc. Class A Common Stock,$24.75,0.41,1.684%,4139036971.00,United States,2021,931302,Technology,Computer Software: Prepackaged Software
KNDI,Kandi Technologies Group Inc Common Stock,$6.03,0.15,2.551%,454586957.00,China,,1131047,Capital Goods,Auto Parts:O.E.M.
KNSA,Kiniksa Pharmaceuticals Ltd. Class A Common Stock,$17.13,0.45,2.698%,1168819368.00,United States,2018,237867,Health Care,Major Pharmaceuticals
KNSL,Kinsale Capital Group Inc. Common Stock,$170.98,-6.49,-3.657%,3900400376.00,United States,2016,105314,Finance,Property-Casualty Insurers
KNTE,Kinnate Biopharma Inc. Common Stock,$26.77,-0.20,-0.742%,1163891042.00,United States,2020,82226,Health Care,Major Pharmaceuticals
KOD,Kodiak Sciences Inc Common Stock,$122.21,1.02,0.842%,6252559837.00,United States,2018,151502,Health Care,Major Pharmaceuticals
KOPN,Kopin Corporation Common Stock,$8.96,0.02,0.224%,817944593.00,United States,1992,2681114,Capital Goods,Industrial Machinery/Components
KOR,Corvus Gold Inc. Common Shares,$2.06,0.06,3.00%,261232658.00,Canada,,72752,,
KOSS,Koss Corporation Common Stock,$19.50,-0.29,-1.465%,166078049.00,United States,,427764,Consumer Non-Durables,Consumer Electronics/Appliances
KPTI,Karyopharm Therapeutics Inc. Common Stock,$9.63,-0.01,-0.104%,722841995.00,United States,2013,871484,Miscellaneous,Diversified Commercial Services
KRBP,Kiromic BioPharma Inc. Common Stock,$8.67,0.32,3.832%,63577101.00,United States,2020,1884,Consumer Durables,Specialty Chemicals
KRKR,36Kr Holdings Inc. American Depositary Shares,$3.04,-0.02,-0.654%,113982794.00,China,2019,84960,Miscellaneous,Business Services
KRMD,Repro Med Systems Inc. Common Stock,$3.59,0.25,7.485%,159667257.00,United States,,315588,Health Care,Medical/Dental Instruments
KRNL,Kernel Group Holdings Inc. Class A Ordinary Shares,$9.74,-0.03,-0.307%,0.00,United States,2021,208739,Finance,Business Services
KRNLU,Kernel Group Holdings Inc. Units,$9.99,0.00,0.00%,0.00,United States,2021,278913,Finance,Business Services
KRNLW,Kernel Group Holdings Inc. Warrants,$0.5898,0.0398,7.236%,0.00,United States,2021,246304,Finance,Business Services
KRNT,Kornit Digital Ltd. Ordinary Shares,$102.40,-1.77,-1.699%,4719480320.00,Israel,2015,81048,Capital Goods,Industrial Machinery/Components
KRNY,Kearny Financial Corp Common Stock,$12.59,0.03,0.239%,1060081286.00,United States,,179755,Finance,Savings Institutions
KRON,Kronos Bio Inc. Common Stock,$25.43,0.47,1.883%,1425292579.00,United States,2020,115424,Consumer Durables,Specialty Chemicals
KROS,Keros Therapeutics Inc. Common Stock,$67.86,2.46,3.761%,1580038261.00,United States,2020,85824,Consumer Durables,Specialty Chemicals
KRT,Karat Packaging Inc. Common Stock,$19.34,0.86,4.654%,369722780.00,United States,2021,209373,Capital Goods,Office Equipment/Supplies/Services
KRTX,Karuna Therapeutics Inc. Common Stock,$112.87,0.40,0.356%,3320022290.00,United States,2019,78867,Health Care,Major Pharmaceuticals
KRUS,Kura Sushi USA Inc. Class A Common Stock,$34.70,-0.72,-2.033%,292090928.00,United States,2019,16370,Consumer Services,Restaurants
KRYS,Krystal Biotech Inc. Common Stock,$81.82,0.21,0.257%,1816772763.00,United States,2017,67152,Health Care,Biotechnology: Biological Products (No Diagnostic Substances)
KSICU,Kadem Sustainable Impact Corporation Unit,$9.97,0.10,1.013%,0.00,United States,2021,9872,,
KSMT,Kismet Acquisition One Corp Ordinary Shares,$9.98,0.04,0.402%,316865000.00,Russia,2020,299291,Finance,Business Services
KSMTU,Kismet Acquisition One Corp Unit,$10.25,-0.031,-0.302%,0.00,Russia,2020,6240,Finance,Business Services
KSMTW,Kismet Acquisition One Corp Warrant,$0.6801,-0.0299,-4.211%,0.00,Russia,,15255,Finance,Business Services
KSPN,Kaspien Holdings Inc. Common Stock,$23.00,0.11,0.481%,57011296.00,United States,,13391,Consumer Services,Consumer Electronics/Video Chains
KTCC,Key Tronic Corporation Common Stock,$6.98,-0.22,-3.056%,75102566.00,United States,1983,92194,Technology,Computer peripheral equipment
KTOS,Kratos Defense & Security Solutions Inc. Common Stock,$27.25,0.15,0.554%,3371832133.00,United States,,474900,Consumer Non-Durables,Ordnance And Accessories
KTRA,Kintara Therapeutics Inc. Common Stock,$1.36,-0.12,-8.108%,41651384.00,United States,,788977,Health Care,Major Pharmaceuticals
KURA,Kura Oncology Inc. Common Stock,$27.75,0.31,1.13%,1837361216.00,United States,,400094,Health Care,Biotechnology: Biological Products (No Diagnostic Substances)
KURI,Alkuri Global Acquisition Corp. Class A common stock,$9.78,0.05,0.514%,421762500.00,United States,2021,170189,,
KURIU,Alkuri Global Acquisition Corp. Unit,$9.96,0.03,0.302%,0.00,United States,2021,12141,,
KURIW,Alkuri Global Acquisition Corp. Warrant,$0.8801,0.04,4.761%,0.00,United States,2021,8076,Finance,Business Services
KVHI,KVH Industries Inc. Common Stock,$13.98,0.28,2.044%,257649163.00,United States,1996,121352,Technology,Radio And Television Broadcasting And Communications Equipment
KVSA,Khosla Ventures Acquisition Co. Class A Common Stock,$10.42,0.07,0.676%,474005800.00,United States,2021,147493,,
KVSB,Khosla Ventures Acquisition Co. II Class A Common Stock,$10.45,0.08,0.771%,498824605.00,United States,2021,285946,,
KVSC,Khosla Ventures Acquisition Co. III Class A Common Stock,$10.24,0.01,0.098%,576512000.00,United States,2021,286003,,
KXIN,Kaixin Auto Holdings Ordinary Share,$2.73,0.11,4.198%,177810767.00,China,2017,1023776,Finance,Business Services
KYMR,Kymera Therapeutics Inc. Common Stock,$45.02,2.93,6.961%,2017413055.00,United States,2020,327211,Consumer Durables,Specialty Chemicals
KZIA,Kazia Therapeutics Limited American Depositary Shares,$11.03,-0.03,-0.271%,139620784.00,Australia,,75465,Health Care,Major Pharmaceuticals
KZR,Kezar Life Sciences Inc. Common Stock,$5.86,0.14,2.448%,281668770.00,United States,2018,212950,Health Care,Major Pharmaceuticals
LABP,Landos Biopharma Inc. Common Stock,$11.76,-0.02,-0.17%,471782952.00,United States,2021,59026,Consumer Durables,Specialty Chemicals
LACQ,Leisure Acquisition Corp. Common Stock,$12.4999,0.00,0.00%,77802728.00,United States,2017,183,,
LACQW,Leisure Acquisition Corp. Warrant,$0.85,0.00,0.00%,0.00,United States,2017,7080,,
LAKE,Lakeland Industries Inc. Common Stock,$28.92,0.12,0.417%,232145959.00,United States,1986,109214,,
LAMR,Lamar Advertising Company Class A Common Stock,$98.70,-0.01,-0.01%,9977720489.00,United States,1996,318166,Consumer Services,Real Estate Investment Trusts
LANC,Lancaster Colony Corporation Common Stock,$182.50,-1.01,-0.55%,5027692500.00,United States,,68020,Consumer Non-Durables,Packaged Foods
LAND,Gladstone Land Corporation Common Stock,$20.94,-0.27,-1.273%,576519054.00,United States,1993,184262,Consumer Services,Real Estate Investment Trusts
LANDM,Gladstone Land Corporation 5.00% Series D Cumulative Term Preferred Stock,$26.103,-0.147,-0.56%,629145104.00,United States,,3684,Consumer Services,Real Estate Investment Trusts
LANDO,Gladstone Land Corporation 6.00% Series B Cumulative Redeemable Preferred Stock,$25.84,0.0542,0.21%,0.00,United States,,21125,Consumer Services,Real Estate Investment Trusts
LARK,Landmark Bancorp Inc. Common Stock,$25.08,0.03,0.12%,119295628.00,United States,,20890,Finance,Major Banks
LASR,nLIGHT Inc. Common Stock,$31.89,0.13,0.409%,1350227575.00,United States,2018,117283,Technology,Semiconductors
LATN,Union Acquisition Corp. II Ordinary Shares,$10.07,0.01,0.099%,251750000.00,United States,2019,7496,Finance,Business Services
LATNU,Union Acquisition Corp. II Units containing one ordinary share and one redeemable warrant,$10.61,0.0061,0.058%,0.00,United States,2019,700,Finance,Business Services
LATNW,Union Acquisition Corp. II Warrant,$0.60,0.012,2.041%,0.00,United States,2019,281560,,
LAUR,Laureate Education Inc. Class A Common Stock,$12.12,0.12,1.00%,2376499272.00,United States,2017,714798,Miscellaneous,Service to the Health Industry
LAWS,Lawson Products Inc. Common Stock,$51.95,1.05,2.063%,471007117.00,United States,,20501,Capital Goods,Industrial Machinery/Components
LAZR,Luminar Technologies Inc.  Class A Common Stock,$24.43,0.58,2.432%,8298665177.00,United States,2019,3982667,Technology,EDP Services
LAZY,Lazydays Holdings Inc. Common Stock,$24.87,0.16,0.648%,267536364.00,United States,,129363,Consumer Services,Other Specialty Stores
LBAI,Lakeland Bancorp Inc. Common Stock,$17.85,0.45,2.586%,903183082.00,United States,,253516,Finance,Major Banks
LBC,Luther Burbank Corporation Common Stock,$11.03,-0.10,-0.898%,576087392.00,United States,2017,57382,Finance,Commercial Banks
LBPH,Longboard Pharmaceuticals Inc. Common Stock,$9.69,0.01,0.103%,163925633.00,United States,2021,6820,Health Care,Major Pharmaceuticals
LBPS,4D pharma plc American Depositary Shares,$12.10,0.04,0.332%,272703339.00,United Kingdom,,12699,Health Care,Major Pharmaceuticals
LBPSW,4D pharma plc Warrant,$0.96,-0.08,-7.692%,0.00,United Kingdom,,30167,Health Care,Major Pharmaceuticals
LBRDA,Liberty Broadband Corporation Class A Common Stock,$153.09,0.14,0.092%,29717314274.00,United States,,38570,Consumer Services,Television Services
LBRDK,Liberty Broadband Corporation Class C Common Stock,$158.34,0.44,0.279%,30736426561.00,United States,,440122,Consumer Services,Television Services
LBRDP,Liberty Broadband Corporation Series A Cumulative Redeemable Preferred Stock,$27.00,-0.02,-0.074%,0.00,United States,,11942,Consumer Services,Television Services
LBTYA,Liberty Global plc Class A Ordinary Shares,$26.53,0.74,2.869%,15318754103.00,United Kingdom,,1538553,,
LBTYB,Liberty Global plc Class B Ordinary Shares,$26.67,0.72,2.775%,15399591855.00,United Kingdom,,169,Consumer Services,Television Services
LBTYK,Liberty Global plc Class C Ordinary Shares,$26.74,0.89,3.443%,15440010731.00,United Kingdom,,3051012,,
LCAAU,L Catterton Asia Acquisition Corp Units,$10.01,0.01,0.10%,0.00,Singapore,2021,4163,Finance,Business Services
LCAHU,Landcadia Holdings IV Inc. Units,$10.00,0.00,0.00%,0.00,United States,2021,153251,,
LCAP,Lionheart Acquisition Corp. II Class A Common Stock,$9.89,0.00,0.00%,290766000.00,United States,2020,32,,
LCAPU,Lionheart Acquisition Corp. II Unit,$10.19,0.00,0.00%,0.00,United States,2020,8,,
LCAPW,Lionheart Acquisition Corp. II Warrant,$0.723,-0.027,-3.60%,0.00,United States,2020,298,Finance,Business Services
LCNB,LCNB Corporation Common Stock,$17.77,0.27,1.543%,227813319.00,United States,,32931,Finance,Major Banks
LCUT,Lifetime Brands Inc. Common Stock,$14.70,-0.10,-0.676%,320043696.00,United States,1991,17078,Consumer Durables,Home Furnishings
LCY,Landcadia Holdings III Inc. Class A Common Stock,$11.15,0.06,0.541%,685725000.00,United States,2020,604925,,
LCYAU,Landcadia Holdings III Inc. Unit ,$11.75,0.00,0.00%,0.00,United States,2020,516,,
LCYAW,Landcadia Holdings III Inc. Warrant,$2.13,0.13,6.50%,0.00,United States,2020,88925,Finance,Business Services
LDHAU,LDH Growth Corp I Units,$10.18,0.075,0.742%,0.00,United States,2021,7448,,
LE,Lands' End Inc. Common Stock,$23.89,0.63,2.709%,779853191.00,United States,,254697,Consumer Services,Clothing/Shoe/Accessory Stores
LECO,Lincoln Electric Holdings Inc. Common Shares,$130.27,0.63,0.486%,7771877456.00,United States,,392173,Capital Goods,Industrial Machinery/Components
LEDS,SemiLEDS Corporation Common Stock,$3.88,-0.17,-4.198%,15744353.00,Taiwan,2010,65533,Technology,Semiconductors
LEE,Lee Enterprises Incorporated Common Stock,$30.00,-0.58,-1.897%,176293590.00,United States,,12323,Consumer Services,Newspapers/Magazines
LEGAU,Lead Edge Growth Opportunities Ltd Units,$10.01,0.00,0.00%,0.00,United States,2021,4994,,
LEGH,Legacy Housing Corporation Common Stock (TX),$17.55,-0.12,-0.679%,424756174.00,United States,2018,20261,Basic Industries,Homebuilding
LEGN,Legend Biotech Corporation American Depositary Shares,$30.46,0.44,1.466%,4051336199.00,United States,2020,329456,Health Care,Major Pharmaceuticals
LEGO,Legato Merger Corp. Common stock,$9.76,0.03,0.308%,259889631.00,United States,2021,8213,,
LEGOU,Legato Merger Corp. Units,$10.22,-0.0182,-0.178%,0.00,United States,2021,103160,,
LEGOW,Legato Merger Corp. Warrant,$0.51,0.0101,2.02%,0.00,United States,2021,68858,Finance,Business Services
LESL,Leslie's Inc. Common Stock,$29.18,0.03,0.103%,5452964090.00,United States,2020,1722617,Consumer Services,
